<?xml version="1.0" encoding="UTF-8"?>
<IN3BLK_Foglalas xmlns:xs="http://www.w3.org/2001/XMLSchema-instance" xs:noNamespaceSchemaLocation="XMLSchemaIN3BLK.xsd"> 

  <Szoba sz_kod="1">
    <Emelet >2</Emelet>
    <Ar >36000</Ar>
    <Szabad >Szabad</Szabad>
  </Szoba>

  <Szoba sz_kod="2">
    <Emelet >5</Emelet>
    <Ar >43000</Ar>
    <Szabad >Szabad</Szabad>
  </Szoba>

  <Szoba sz_kod="3">
    <Emelet >1</Emelet>
    <Ar >31000</Ar>
    <Szabad >Foglalt</Szabad>
  </Szoba>


  <Alkalmazott a_kod="1" h_kod="1">
    <Telefon >06-70-938-5617</Telefon>
    <Nev >Tóth András</Nev>
    <Ber >320000</Ber>
    <Beosztas >Portás</Beosztas>
  </Alkalmazott>

  <Alkalmazott a_kod="2" h_kod="2">
    <Telefon >06-30-294-7335</Telefon>
    <Telefon >06-20-993-3744</Telefon>
    <Nev >Lakatos Kevin</Nev>
    <Ber >390000</Ber>
    <Beosztas >Szakács</Beosztas>
  </Alkalmazott>

  <Alkalmazott a_kod="3" h_kod="3">
    <Telefon >06-70-223-9485</Telefon>
    <Nev >Szabó Ilona</Nev>
    <Ber >280000</Ber>
    <Beosztas >Takarító</Beosztas>
  </Alkalmazott>


  <Hotel h_kod="1" sz_kod="1">
    <Telefon >06-20-993-7766</Telefon>
    <Nev >Kényelem Hotel</Nev>
    <Cim >
      <Irszam >1028</Irszam>
      <Varos >Budapest</Varos>
      <Utca-hazszam >Szeles utca 25</Utca-hazszam>
    </Cim>
    <Ertekeles >3</Ertekeles>
  </Hotel>

  <Hotel h_kod="2" sz_kod="2">
    <Telefon >06-70-234-3443</Telefon>
    <Nev >Royal Hotel</Nev>
    <Cim >
      <Irszam >4033</Irszam>
      <Varos >Debrecen</Varos>
      <Utca-hazszam >Erdei utca 6</Utca-hazszam>
    </Cim>
    <Ertekeles >5</Ertekeles>
  </Hotel>

  <Hotel h_kod="3" sz_kod="3">
    <Telefon >06-30-345-2345</Telefon>
    <Telefon >06-30-999-2384</Telefon>
    <Nev >Udvari Hotel</Nev>
    <Cim >
      <Irszam >3521</Irszam>
      <Varos >Miskolc</Varos>
      <Utca-hazszam >Jakab utca 56</Utca-hazszam>
    </Cim>
    <Ertekeles >4</Ertekeles>
  </Hotel>


  <Szamla szam_kod="1" v_kod="1">
    <Nev >Kiss Anna</Nev>
    <Datum >2020-02-17</Datum>
    <Osszeg >86000</Osszeg>
  </Szamla>

  <Szamla szam_kod="2" v_kod="2">
    <Nev >Török András</Nev>
    <Datum >2021-09-10</Datum>
    <Osszeg >113000</Osszeg>
  </Szamla>

  <Szamla szam_kod="3" v_kod="3">
    <Nev >Horváth Áron</Nev>
    <Datum >2022-05-14</Datum>
    <Osszeg >93000</Osszeg>
  </Szamla>


  <Vevo sz_kod="1" v_kod="1">
    <Telefon >06-30-222-2345</Telefon>
    <Telefon >06-70-399-5577</Telefon>
    <Nev >Kiss Anna</Nev>
    <Email >kAnna@gmail.com</Email>
  </Vevo>

  <Vevo sz_kod="2" v_kod="2">
    <Telefon >06-20-948-3857</Telefon>
    <Telefon >06-30-947-5872</Telefon>
    <Nev >Török András</Nev>
    <Email >tAndras@freemail.hu</Email>
  </Vevo>

  <Vevo sz_kod="3" v_kod="3">
    <Telefon >06-70-993-6665</Telefon>
    <Nev >Horváth Áron</Nev>
    <Email >hAron@gmail.com</Email>
  </Vevo>


  <Foglalas sz_kod="1" v_kod="1">
    <Kezdet >2020-02-10</Kezdet>
    <Vege >2020-02-17</Vege>
  </Foglalas>

  <Foglalas sz_kod="2" v_kod="2">
    <Kezdet >2021-09-03</Kezdet>
    <Vege >2021-09-10</Vege>
  </Foglalas>

  <Foglalas sz_kod="3" v_kod="3">
    <Kezdet >2022-05-10</Kezdet>
    <Vege >2022-05-14</Vege>
  </Foglalas>


  <Fizetes szam_kod="1" v_kod="1">
    <Datum >2020-02-17</Datum>
    <Fizetesmod >Készpénz</Fizetesmod>
  </Fizetes>

  <Fizetes szam_kod="2" v_kod="2">
    <Datum >2021-09-10</Datum>
    <Fizetesmod >Bankkártya</Fizetesmod>
  </Fizetes>

  <Fizetes szam_kod="3" v_kod="3">
    <Datum >2022-05-14</Datum>
    <Fizetesmod >Bankkártya</Fizetesmod>
  </Fizetes>

</IN3BLK_Foglalas>